{
  "schemaVersion": "1.1",
  "id": "power-system-analysis-swjtu-inspired",
  "title": "电力系统分析",
  "subject": "电气工程",
  "level": "大学",
  "source": "preset",
  "language": "zh-CN",
  "description": "以中国大学 MOOC 西南交通大学《电力系统分析》公开课程主题为蓝本组织的原创教学内容，覆盖电力系统基础、元件建模、潮流计算、短路故障与牵引供电。",
  "contentVersion": "0.3.0-draft",
  "generatedOn": "2026-10-25",
  "reviewStatus": "pending",
  "license": {
    "code": "MIT",
    "content": "CC BY 4.0"
  },
  "sourceRefs": [
    {
      "title": "中国大学 MOOC：西南交通大学《电力系统分析》",
      "url": "https://www.icourse163.org/course/SWJTU-1465999174",
      "note": "仅参考课程主题组织，不含视频、课件或教材原文；课时编号映射待按公开大纲补充。"
    },
    {
      "title": "王晓茹、高仕斌主编《电力系统分析》第二版，高等教育出版社",
      "url": "",
      "note": "该课程页面列出的参考教材。"
    }
  ],
  "chapters": [
    {
      "id": "ch1-intro",
      "order": 1,
      "title": "认识电力系统",
      "description": "电力系统的组成、电压等级、负荷、电能质量与中性点接地方式。",
      "concepts": [
        {
          "id": "ps-composition",
          "chapterId": "ch1-intro",
          "order": 1,
          "title": "电力系统的组成与运行特点",
          "prerequisites": [],
          "summary": "电力系统由发电、输电、变电、配电和用电五个环节组成，发电与用电必须实时平衡。",
          "explanation": "电力系统是把一次能源转换成电能并输送、分配给用户的整体，包括发电厂、升降压变电站、输电线路、配电网和用户负荷。只包含输电、变电、配电部分的称为电力网。与其他能源系统相比，电能难以大量经济地储存，因此发电量必须时刻跟随用电量变化；电磁暂态过程以毫秒计，故障若不及时切除会迅速扩大；电力系统又与工业生产和居民生活紧密相关。由此得出对电力系统运行的基本要求：保证供电安全可靠、保证电能质量、提高运行经济性，并减少对环境的影响。",
          "keyFormulas": [
            {
              "latex": "P_G = P_L + \\Delta P",
              "display": "P_G = P_L + ΔP",
              "variables": [
                {
                  "symbol": "P_G",
                  "meaning": "系统总发电功率",
                  "unit": "MW"
                },
                {
                  "symbol": "P_L",
                  "meaning": "用户总负荷",
                  "unit": "MW"
                },
                {
                  "symbol": "ΔP",
                  "meaning": "网络总损耗",
                  "unit": "MW"
                }
              ],
              "conditions": "任一时刻有功功率平衡；无功功率同样需要平衡。"
            }
          ],
          "workedExample": {
            "problem": "某地区电网某时刻用户总负荷为 300 MW，线损率（损耗占供电量的比例）为 3%，此时发电厂需要送出多少有功功率？",
            "steps": [
              "线损率定义为 ΔP / P_G = 3%，所以 P_L = P_G (1 − 0.03)。",
              "P_G = 300 / 0.97 ≈ 309.3 MW。",
              "其中网络损耗约 9.3 MW。"
            ],
            "answer": "约 309.3 MW"
          },
          "misconceptions": [
            {
              "wrong": "电能可以像煤一样先存起来再用。",
              "correct": "电能难以大量经济储存，抽水蓄能和电池储能只占很小比例，系统必须实时平衡。"
            },
            {
              "wrong": "电力网就是电力系统。",
              "correct": "电力网只包括输电、变电、配电设备，不含发电厂和用户负荷。"
            }
          ],
          "visualization": null,
          "images": [],
          "practice": [
            {
              "question": "为什么说“频率是有功功率平衡的晴雨表”？",
              "answer": "有功不平衡时发电机转速随之变化，频率偏离额定值。",
              "explanation": "发电机输入机械功率与输出电磁功率之差使转子加速或减速，频率随之变化，所以频率反映全系统有功平衡情况。"
            }
          ],
          "aiGuidance": {
            "guidingQuestions": [
              "如果某一刻用电突然增加而发电没跟上，你觉得系统里哪个量会先变化？",
              "电能不能大量储存，这会给运行带来什么要求？"
            ],
            "constraints": [
              "先让学生说出自己的理解，再逐步提示，不直接给出完整答案。",
              "数值结论以计算器或课程给定答案为准，不自行心算。",
              "说明所用近似和适用条件，教学参数不作为工程整定依据。"
            ]
          },
          "sourceRefs": [
            {
              "title": "西南交通大学《电力系统分析》（中国大学 MOOC）对应章节主题",
              "url": "https://www.icourse163.org/course/SWJTU-1465999174",
              "lessonCodes": []
            }
          ],
          "reviewStatus": "pending"
        },
        {
          "id": "ps-voltage-levels",
          "chapterId": "ch1-intro",
          "order": 2,
          "title": "额定电压等级与各元件额定电压",
          "prerequisites": [
            "ps-composition"
          ],
          "summary": "我国交流电网额定电压分级，发电机和变压器的额定电压按“补偿线路压降”的原则高于网络额定电压。",
          "explanation": "输送功率一定时，电压越高电流越小，线路损耗和压降越小，但绝缘与设备投资越大，因此电网按标准电压等级分层建设。我国常用交流额定电压（线电压）有 0.38、3、6、10、20、35、66、110、220、330、500、750、1000 kV。线路首端电压高、末端电压低，平均约等于额定电压，所以用电设备的额定电压等于网络额定电压；发电机位于线路首端，额定电压比网络额定电压高 5%；变压器一次绕组相当于用电设备，额定电压等于网络额定电压（直接接发电机时等于发电机额定电压），二次绕组相当于电源，一般比网络额定电压高 10%（短路电压较小或直接向近处负荷供电时可只高 5%）。短路计算中常用的平均额定电压约为 1.05 倍额定电压：10.5、37、115、230、345、525 kV。",
          "keyFormulas": [
            {
              "latex": "U_{GN} = 1.05\\,U_N",
              "display": "U_GN = 1.05 U_N",
              "variables": [
                {
                  "symbol": "U_GN",
                  "meaning": "发电机额定电压",
                  "unit": "kV"
                },
                {
                  "symbol": "U_N",
                  "meaning": "所接网络额定电压",
                  "unit": "kV"
                }
              ],
              "conditions": ""
            },
            {
              "latex": "U_{2N} = (1.05 \\sim 1.10)\\,U_N",
              "display": "U_2N = (1.05~1.10) U_N",
              "variables": [
                {
                  "symbol": "U_2N",
                  "meaning": "变压器二次侧额定电压",
                  "unit": "kV"
                },
                {
                  "symbol": "U_N",
                  "meaning": "二次侧所接网络额定电压",
                  "unit": "kV"
                }
              ],
              "conditions": "二次侧所接线路较长时取 1.10。"
            },
            {
              "latex": "U_{av} \\approx 1.05\\,U_N",
              "display": "U_av ≈ 1.05 U_N",
              "variables": [
                {
                  "symbol": "U_av",
                  "meaning": "平均额定电压",
                  "unit": "kV"
                }
              ],
              "conditions": "用于短路实用计算的近似。"
            }
          ],
          "workedExample": {
            "problem": "一台发电机接在 10 kV 母线上，经升压变压器送入 110 kV 输电线路。求发电机额定电压和升压变压器额定变比。",
            "steps": [
              "发电机额定电压 = 1.05 × 10 = 10.5 kV。",
              "变压器一次侧直接接发电机，额定电压取 10.5 kV。",
              "二次侧接 110 kV 线路，额定电压取 1.10 × 110 = 121 kV。"
            ],
            "answer": "发电机 10.5 kV；变压器额定变比 10.5/121 kV"
          },
          "misconceptions": [
            {
              "wrong": "变压器两侧额定电压就是两侧网络的额定电压。",
              "correct": "二次侧要补偿变压器内部压降和线路压降，通常比网络额定电压高 5%~10%。"
            },
            {
              "wrong": "额定电压指相电压。",
              "correct": "三相系统的额定电压指线电压。"
            }
          ],
          "visualization": {
            "calculator": "rated-voltage-chain",
            "params": [
              {
                "id": "UN1",
                "label": "一次侧网络额定电压",
                "unit": "kV",
                "min": 6,
                "max": 500,
                "step": 1,
                "default": 10
              },
              {
                "id": "UN2",
                "label": "二次侧网络额定电压",
                "unit": "kV",
                "min": 0.38,
                "max": 500,
                "step": 1,
                "default": 110
              },
              {
                "id": "k2",
                "label": "二次侧高出比例",
                "unit": "%",
                "min": 5,
                "max": 10,
                "step": 5,
                "default": 10
              }
            ],
            "output": "发电机额定电压、变压器额定变比",
            "assumptions": "按教材约定的额定电压规则计算，不涉及具体产品分接头。"
          },
          "images": [],
          "practice": [
            {
              "question": "一台降压变压器从 220 kV 电网向 110 kV 电网供电，其额定变比通常是多少？",
              "answer": "220/121 kV",
              "explanation": "一次侧等于网络额定电压 220 kV，二次侧按高 10% 取 121 kV。"
            }
          ],
          "aiGuidance": {
            "guidingQuestions": [
              "线路首端和末端的电压一样高吗？这和发电机额定电压高 5% 有什么关系？",
              "变压器二次侧对它所接的线路来说扮演什么角色？"
            ],
            "constraints": [
              "先让学生说出自己的理解，再逐步提示，不直接给出完整答案。",
              "数值结论以计算器或课程给定答案为准，不自行心算。",
              "说明所用近似和适用条件，教学参数不作为工程整定依据。"
            ]
          },
          "sourceRefs": [
            {
              "title": "西南交通大学《电力系统分析》（中国大学 MOOC）对应章节主题",
              "url": "https://www.icourse163.org/course/SWJTU-1465999174",
              "lessonCodes": []
            }
          ],
          "reviewStatus": "pending"
        },
        {
          "id": "ps-load-curve",
          "chapterId": "ch1-intro",
          "order": 3,
          "title": "负荷曲线与最大负荷利用小时数",
          "prerequisites": [
            "ps-composition"
          ],
          "summary": "负荷曲线描述负荷随时间的变化，最大负荷利用小时数和负荷率概括其形状，用于规划和经济分析。",
          "explanation": "按时间段不同，负荷曲线分日、周、年负荷曲线；按内容分有功和无功负荷曲线。日负荷曲线的峰谷差决定了调峰需求。把一年的用电量折算成按最大负荷连续运行的小时数，就是最大负荷利用小时数 T_max，它越大说明负荷越平稳。平均负荷与最大负荷之比称为负荷率。年持续负荷曲线把全年负荷从大到小排列，面积等于年用电量。负荷特性还包括负荷随电压、频率变化的静态特性，见“负荷模型”一节。",
          "keyFormulas": [
            {
              "latex": "T_{max} = \\dfrac{W}{P_{max}}",
              "display": "T_max = W / P_max",
              "variables": [
                {
                  "symbol": "T_max",
                  "meaning": "最大负荷利用小时数",
                  "unit": "h"
                },
                {
                  "symbol": "W",
                  "meaning": "年用电量",
                  "unit": "MWh"
                },
                {
                  "symbol": "P_max",
                  "meaning": "年最大负荷",
                  "unit": "MW"
                }
              ],
              "conditions": ""
            },
            {
              "latex": "k_L = \\dfrac{P_{av}}{P_{max}}",
              "display": "k_L = P_av / P_max",
              "variables": [
                {
                  "symbol": "k_L",
                  "meaning": "负荷率",
                  "unit": "—"
                },
                {
                  "symbol": "P_av",
                  "meaning": "平均负荷",
                  "unit": "MW"
                }
              ],
              "conditions": ""
            }
          ],
          "workedExample": {
            "problem": "某用户年最大负荷 50 MW，年用电量 25 万 MWh。求最大负荷利用小时数和年负荷率。",
            "steps": [